[
  {
    "arranger_id": "ARR_001",
    "creator_id": "CRT_NEL_BLU_DIPINTO_DI_BLU_VOLARE_0000",
    "arrangement_discipline": "Orchestral and Big Band",
    "resident_orchestra_ensemble": "London Symphony Orchestra / Los Angeles Philharmonic",
    "formal_conservatory_education": "Juilliard School of Music",
    "sheet_music_publisher": "Hal Leonard Corporation",
    "conducts_own_compositions": true,
    "classical_crossover_experience": true,
    "union_musicians_local": "AFM Local 47 (Los Angeles)",
    "career_commission_count": 25
  },
  {
    "arranger_id": "ARR_002",
    "creator_id": "CRT_HENRY_MANCINI_0001",
    "arrangement_discipline": "Orchestral and Big Band",
    "resident_orchestra_ensemble": "London Symphony Orchestra / Los Angeles Philharmonic",
    "formal_conservatory_education": "Juilliard School of Music",
    "sheet_music_publisher": "Hal Leonard Corporation",
    "conducts_own_compositions": true,
    "classical_crossover_experience": true,
    "union_musicians_local": "AFM Local 47 (Los Angeles)",
    "career_commission_count": 26
  },
  {
    "arranger_id": "ARR_003",
    "creator_id": "CRT_ELLA_FITZGERALD_0002",
    "arrangement_discipline": "Orchestral and Big Band",
    "resident_orchestra_ensemble": "London Symphony Orchestra / Los Angeles Philharmonic",
    "formal_conservatory_education": "Juilliard School of Music",
    "sheet_music_publisher": "Hal Leonard Corporation",
    "conducts_own_compositions": true,
    "classical_crossover_experience": true,
    "union_musicians_local": "AFM Local 47 (Los Angeles)",
    "career_commission_count": 27
  },
  {
    "arranger_id": "ARR_004",
    "creator_id": "CRT_CATCH_A_FALLING_STAR_0003",
    "arrangement_discipline": "Orchestral and Big Band",
    "resident_orchestra_ensemble": "London Symphony Orchestra / Los Angeles Philharmonic",
    "formal_conservatory_education": "Juilliard School of Music",
    "sheet_music_publisher": "Hal Leonard Corporation",
    "conducts_own_compositions": true,
    "classical_crossover_experience": true,
    "union_musicians_local": "AFM Local 47 (Los Angeles)",
    "career_commission_count": 28
  },
  {
    "arranger_id": "ARR_005",
    "creator_id": "CRT_BILLY_MAY_S_BIG_FAT_BRASS_0004",
    "arrangement_discipline": "Orchestral and Big Band",
    "resident_orchestra_ensemble": "London Symphony Orchestra / Los Angeles Philharmonic",
    "formal_conservatory_education": "Juilliard School of Music",
    "sheet_music_publisher": "Hal Leonard Corporation",
    "conducts_own_compositions": true,
    "classical_crossover_experience": true,
    "union_musicians_local": "AFM Local 47 (Los Angeles)",
    "career_commission_count": 29
  },
  {
    "arranger_id": "ARR_006",
    "creator_id": "CRT_BASIE_0005",
    "arrangement_discipline": "Orchestral and Big Band",
    "resident_orchestra_ensemble": "London Symphony Orchestra / Los Angeles Philharmonic",
    "formal_conservatory_education": "Juilliard School of Music",
    "sheet_music_publisher": "Hal Leonard Corporation",
    "conducts_own_compositions": true,
    "classical_crossover_experience": true,
    "union_musicians_local": "AFM Local 47 (Los Angeles)",
    "career_commission_count": 30
  },
  {
    "arranger_id": "ARR_007",
    "creator_id": "CRT_THAT_OLD_BLACK_MAGIC_0006",
    "arrangement_discipline": "Orchestral and Big Band",
    "resident_orchestra_ensemble": "London Symphony Orchestra / Los Angeles Philharmonic",
    "formal_conservatory_education": "Juilliard School of Music",
    "sheet_music_publisher": "Hal Leonard Corporation",
    "conducts_own_compositions": true,
    "classical_crossover_experience": true,
    "union_musicians_local": "AFM Local 47 (Los Angeles)",
    "career_commission_count": 31
  },
  {
    "arranger_id": "ARR_008",
    "creator_id": "CRT_THE_CHIPMUNK_SONG_0007",
    "arrangement_discipline": "Orchestral and Big Band",
    "resident_orchestra_ensemble": "London Symphony Orchestra / Los Angeles Philharmonic",
    "formal_conservatory_education": "Juilliard School of Music",
    "sheet_music_publisher": "Hal Leonard Corporation",
    "conducts_own_compositions": true,
    "classical_crossover_experience": true,
    "union_musicians_local": "AFM Local 47 (Los Angeles)",
    "career_commission_count": 32
  },
  {
    "arranger_id": "ARR_009",
    "creator_id": "CRT_TOM_DOOLEY_0008",
    "arrangement_discipline": "Orchestral and Big Band",
    "resident_orchestra_ensemble": "London Symphony Orchestra / Los Angeles Philharmonic",
    "formal_conservatory_education": "Juilliard School of Music",
    "sheet_music_publisher": "Hal Leonard Corporation",
    "conducts_own_compositions": true,
    "classical_crossover_experience": true,
    "union_musicians_local": "AFM Local 47 (Los Angeles)",
    "career_commission_count": 33
  },
  {
    "arranger_id": "ARR_010",
    "creator_id": "CRT_TEQUILA_0009",
    "arrangement_discipline": "Orchestral and Big Band",
    "resident_orchestra_ensemble": "London Symphony Orchestra / Los Angeles Philharmonic",
    "formal_conservatory_education": "Juilliard School of Music",
    "sheet_music_publisher": "Hal Leonard Corporation",
    "conducts_own_compositions": true,
    "classical_crossover_experience": true,
    "union_musicians_local": "AFM Local 47 (Los Angeles)",
    "career_commission_count": 34
  },
  {
    "arranger_id": "ARR_011",
    "creator_id": "CRT_DUETS_WITH_A_SPANISH_GUITAR_0010",
    "arrangement_discipline": "Orchestral and Big Band",
    "resident_orchestra_ensemble": "London Symphony Orchestra / Los Angeles Philharmonic",
    "formal_conservatory_education": "Juilliard School of Music",
    "sheet_music_publisher": "Hal Leonard Corporation",
    "conducts_own_compositions": true,
    "classical_crossover_experience": true,
    "union_musicians_local": "AFM Local 47 (Los Angeles)",
    "career_commission_count": 35
  },
  {
    "arranger_id": "ARR_012",
    "creator_id": "CRT_FRANK_SINATRA_0011",
    "arrangement_discipline": "Orchestral and Big Band",
    "resident_orchestra_ensemble": "London Symphony Orchestra / Los Angeles Philharmonic",
    "formal_conservatory_education": "Juilliard School of Music",
    "sheet_music_publisher": "Hal Leonard Corporation",
    "conducts_own_compositions": true,
    "classical_crossover_experience": true,
    "union_musicians_local": "AFM Local 47 (Los Angeles)",
    "career_commission_count": 36
  },
  {
    "arranger_id": "ARR_013",
    "creator_id": "CRT_CROSS_COUNTRY_SUITE_0012",
    "arrangement_discipline": "Orchestral and Big Band",
    "resident_orchestra_ensemble": "London Symphony Orchestra / Los Angeles Philharmonic",
    "formal_conservatory_education": "Juilliard School of Music",
    "sheet_music_publisher": "Hal Leonard Corporation",
    "conducts_own_compositions": true,
    "classical_crossover_experience": true,
    "union_musicians_local": "AFM Local 47 (Los Angeles)",
    "career_commission_count": 37
  },
  {
    "arranger_id": "ARR_014",
    "creator_id": "CRT_THE_MUSIC_MAN_0013",
    "arrangement_discipline": "Orchestral and Big Band",
    "resident_orchestra_ensemble": "London Symphony Orchestra / Los Angeles Philharmonic",
    "formal_conservatory_education": "Juilliard School of Music",
    "sheet_music_publisher": "Hal Leonard Corporation",
    "conducts_own_compositions": true,
    "classical_crossover_experience": true,
    "union_musicians_local": "AFM Local 47 (Los Angeles)",
    "career_commission_count": 38
  },
  {
    "arranger_id": "ARR_015",
    "creator_id": "CRT_ANDR_PREVIN_0014",
    "arrangement_discipline": "Orchestral and Big Band",
    "resident_orchestra_ensemble": "London Symphony Orchestra / Los Angeles Philharmonic",
    "formal_conservatory_education": "Juilliard School of Music",
    "sheet_music_publisher": "Hal Leonard Corporation",
    "conducts_own_compositions": true,
    "classical_crossover_experience": true,
    "union_musicians_local": "AFM Local 47 (Los Angeles)",
    "career_commission_count": 39
  },
  {
    "arranger_id": "ARR_016",
    "creator_id": "CRT_THE_BEST_OF_THE_STAN_FREBERG_S_0015",
    "arrangement_discipline": "Orchestral and Big Band",
    "resident_orchestra_ensemble": "London Symphony Orchestra / Los Angeles Philharmonic",
    "formal_conservatory_education": "Juilliard School of Music",
    "sheet_music_publisher": "Hal Leonard Corporation",
    "conducts_own_compositions": true,
    "classical_crossover_experience": true,
    "union_musicians_local": "AFM Local 47 (Los Angeles)",
    "career_commission_count": 40
  },
  {
    "arranger_id": "ARR_017",
    "creator_id": "CRT_GAIETE_PARISIENNE_0016",
    "arrangement_discipline": "Orchestral and Big Band",
    "resident_orchestra_ensemble": "London Symphony Orchestra / Los Angeles Philharmonic",
    "formal_conservatory_education": "Juilliard School of Music",
    "sheet_music_publisher": "Hal Leonard Corporation",
    "conducts_own_compositions": true,
    "classical_crossover_experience": true,
    "union_musicians_local": "AFM Local 47 (Los Angeles)",
    "career_commission_count": 41
  },
  {
    "arranger_id": "ARR_018",
    "creator_id": "CRT_TCHAIKOVSKY_PIANO_CONCERTO_NO__0017",
    "arrangement_discipline": "Orchestral and Big Band",
    "resident_orchestra_ensemble": "London Symphony Orchestra / Los Angeles Philharmonic",
    "formal_conservatory_education": "Juilliard School of Music",
    "sheet_music_publisher": "Hal Leonard Corporation",
    "conducts_own_compositions": true,
    "classical_crossover_experience": true,
    "union_musicians_local": "AFM Local 47 (Los Angeles)",
    "career_commission_count": 42
  },
  {
    "arranger_id": "ARR_019",
    "creator_id": "CRT_SEGOVIA_GOLDEN_JUBILEE_0018",
    "arrangement_discipline": "Orchestral and Big Band",
    "resident_orchestra_ensemble": "London Symphony Orchestra / Los Angeles Philharmonic",
    "formal_conservatory_education": "Juilliard School of Music",
    "sheet_music_publisher": "Hal Leonard Corporation",